{
  "$schema": "https://json-schema.org/draft/2020-12/schema",
  "$id": "https://github.com/tt-a1i/archify/schemas/erd.schema.json",
  "title": "Archify Entity Relationship Diagram",
  "type": "object",
  "additionalProperties": false,
  "required": ["schema_version", "diagram_type", "meta", "tables", "relationships"],
  "properties": {
    "schema_version": { "const": 1 },
    "diagram_type": { "const": "erd" },
    "meta": {
      "type": "object",
      "additionalProperties": false,
      "required": ["title"],
      "properties": {
        "title": { "type": "string", "minLength": 1 },
        "locale": { "$ref": "common.schema.json#/$defs/locale" },
        "subtitle": { "type": "string" },
        "output": { "type": "string" },
        "animation": { "$ref": "common.schema.json#/$defs/animation" },
        "visual_preset": { "$ref": "common.schema.json#/$defs/visualPreset" },
        "logo": { "$ref": "common.schema.json#/$defs/diagramLogo" },
        "quality_profile": { "$ref": "common.schema.json#/$defs/qualityProfile" },
        "detail": { "enum": ["tables", "keys", "full"] },
        "repository": { "$ref": "common.schema.json#/$defs/repository" },
        "viewBox": {
          "type": "array",
          "prefixItems": [{ "type": "number", "minimum": 420 }, { "type": "number", "minimum": 566 }],
          "items": false,
          "minItems": 2,
          "maxItems": 2
        },
        "views": { "$ref": "common.schema.json#/$defs/guidedViews" },
        "legend": { "$ref": "common.schema.json#/$defs/modelLegend" }
      }
    },
    "layout": { "$ref": "common.schema.json#/$defs/modelLayout" },
    "groups": {
      "type": "array",
      "items": {
        "type": "object",
        "additionalProperties": false,
        "required": ["id", "label", "wraps"],
        "properties": {
          "id": { "$ref": "common.schema.json#/$defs/id" },
          "label": { "type": "string", "minLength": 1, "maxLength": 60 },
          "kind": { "enum": ["schema", "module", "service"] },
          "wraps": {
            "type": "array",
            "minItems": 1,
            "items": { "$ref": "common.schema.json#/$defs/id" }
          },
          "pad": { "type": "number", "minimum": 8, "maximum": 80 }
        }
      }
    },
    "tables": {
      "type": "array",
      "minItems": 1,
      "items": {
        "type": "object",
        "additionalProperties": false,
        "required": ["id", "label"],
        "properties": {
          "id": { "$ref": "common.schema.json#/$defs/id" },
          "kind": { "enum": ["table", "view", "junction"] },
          "label": { "type": "string", "minLength": 1, "maxLength": 48 },
          "note": { "type": "string", "minLength": 1, "maxLength": 80 },
          "row": { "type": "integer", "minimum": 0 },
          "col": { "type": "integer", "minimum": 0 },
          "pos": { "$ref": "common.schema.json#/$defs/point" },
          "width": { "type": "number", "minimum": 100, "maximum": 400 },
          "columns": {
            "type": "array",
            "maxItems": 32,
            "items": { "$ref": "common.schema.json#/$defs/modelColumn" }
          },
          "sources": { "$ref": "common.schema.json#/$defs/sources" }
        }
      }
    },
    "relationships": {
      "type": "array",
      "items": {
        "type": "object",
        "additionalProperties": false,
        "required": ["from", "to", "kind"],
        "properties": {
          "id": { "$ref": "common.schema.json#/$defs/id" },
          "from": { "$ref": "common.schema.json#/$defs/id" },
          "to": { "$ref": "common.schema.json#/$defs/id" },
          "kind": { "enum": ["one-to-one", "one-to-many", "many-to-one", "many-to-many"] },
          "label": { "type": "string", "minLength": 1, "maxLength": 40 },
          "from_optional": { "type": "boolean" },
          "to_optional": { "type": "boolean" },
          "fromSide": { "$ref": "common.schema.json#/$defs/modelSide" },
          "toSide": { "$ref": "common.schema.json#/$defs/modelSide" },
          "route": { "enum": ["auto", "straight", "orthogonal-h", "orthogonal-v"] },
          "via": {
            "type": "array",
            "minItems": 1,
            "maxItems": 6,
            "items": { "$ref": "common.schema.json#/$defs/point" }
          },
          "labelAt": { "$ref": "common.schema.json#/$defs/point" },
          "labelSegment": { "type": "integer", "minimum": 0 },
          "labelDx": { "type": "number" },
          "labelDy": { "type": "number" }
        }
      }
    },
    "cards": { "$ref": "common.schema.json#/$defs/cards" }
  }
}
